{
  "metadata": {
    "name": "vue3",
    "version": "1.0.0",
    "category": "framework",
    "description": "Vue 3 framework core configuration",
    "author": "Scaffold MCP Server",
    "homepage": "https://vuejs.org/",
    "keywords": ["vue", "vue3", "framework", "frontend", "spa"]
  },
  "activation": {
    "framework": ["vue3", "vue"],
    "techStack": {
      "framework": ["vue3", "vue"]
    }
  },
  "dependencies": [
    {
      "name": "vue",
      "version": "^3.3.8",
      "type": "dependencies"
    },
    {
      "name": "@vitejs/plugin-vue",
      "version": "^4.5.0",
      "type": "devDependencies",
      "condition": {
        "builder": ["vite"]
      }
    },
    {
      "name": "vue-loader",
      "version": "^17.3.1",
      "type": "devDependencies",
      "condition": {
        "builder": ["webpack"]
      }
    },
    {
      "name": "@vue/compiler-sfc",
      "version": "^3.3.8",
      "type": "devDependencies"
    },
    {
      "name": "@vue/tsconfig",
      "version": "^0.4.0",
      "type": "devDependencies",
      "condition": {
        "language": ["typescript"]
      }
    }
  ],
  "scripts": {
    "dev": "vite",
    "build": "vite build",
    "preview": "vite preview"
  },
  "files": [
    {
      "path": "src/main.js",
      "content": "import { createApp } from 'vue'\nimport App from './App.vue'\n\nconst app = createApp(App)\n\napp.mount('#app')",
      "condition": {
        "language": ["javascript"]
      }
    },
    {
      "path": "src/main.ts",
      "content": "import { createApp } from 'vue'\nimport App from './App.vue'\n\nconst app = createApp(App)\n\napp.mount('#app')",
      "condition": {
        "language": ["typescript"]
      }
    },
    {
      "path": "src/App.vue",
      "content": "<template>\n  <div id=\"app\">\n    <header>\n      <h1>Welcome to Vue 3</h1>\n    </header>\n    <main>\n      <HelloWorld msg=\"Hello Vue 3 + Vite\" />\n    </main>\n  </div>\n</template>\n\n<script setup>\nimport HelloWorld from './components/HelloWorld.vue'\n</script>\n\n<style scoped>\n#app {\n  font-family: Avenir, Helvetica, Arial, sans-serif;\n  -webkit-font-smoothing: antialiased;\n  -moz-osx-font-smoothing: grayscale;\n  text-align: center;\n  color: #2c3e50;\n  margin-top: 60px;\n}\n\nheader {\n  margin-bottom: 2rem;\n}\n\nh1 {\n  color: #42b883;\n}\n</style>"
    },
    {
      "path": "src/components/HelloWorld.vue",
      "content": "<template>\n  <div class=\"hello\">\n    <h2>{{ msg }}</h2>\n    <p>\n      Edit <code>src/components/HelloWorld.vue</code> to test HMR\n    </p>\n    <p>\n      <a href=\"https://vitejs.dev/guide/features.html\" target=\"_blank\">\n        Vite Docs\n      </a>\n      |\n      <a href=\"https://v3.vuejs.org/\" target=\"_blank\">Vue 3 Docs</a>\n    </p>\n    <button type=\"button\" @click=\"count++\">count is: {{ count }}</button>\n  </div>\n</template>\n\n<script setup>\nimport { ref } from 'vue'\n\ndefineProps({\n  msg: String\n})\n\nconst count = ref(0)\n</script>\n\n<style scoped>\n.hello {\n  padding: 2rem;\n}\n\na {\n  color: #42b883;\n}\n\nbutton {\n  background-color: #42b883;\n  color: white;\n  border: none;\n  padding: 0.5rem 1rem;\n  border-radius: 4px;\n  cursor: pointer;\n  font-size: 1rem;\n  margin: 1rem;\n}\n\nbutton:hover {\n  background-color: #369870;\n}\n\ncode {\n  background-color: #f3f3f3;\n  padding: 0.2rem 0.4rem;\n  border-radius: 3px;\n  font-family: 'Courier New', Courier, monospace;\n}\n</style>"
    },
    {
      "path": "index.html",
      "content": "<!DOCTYPE html>\n<html lang=\"en\">\n  <head>\n    <meta charset=\"UTF-8\" />\n    <link rel=\"icon\" type=\"image/svg+xml\" href=\"/vite.svg\" />\n    <meta name=\"viewport\" content=\"width=device-width, initial-scale=1.0\" />\n    <title>Vue 3 App</title>\n  </head>\n  <body>\n    <div id=\"app\"></div>\n    <script type=\"module\" src=\"/src/main.js\"></script>\n  </body>\n</html>",
      "condition": {
        "language": ["javascript"]
      }
    },
    {
      "path": "index.html",
      "content": "<!DOCTYPE html>\n<html lang=\"en\">\n  <head>\n    <meta charset=\"UTF-8\" />\n    <link rel=\"icon\" type=\"image/svg+xml\" href=\"/vite.svg\" />\n    <meta name=\"viewport\" content=\"width=device-width, initial-scale=1.0\" />\n    <title>Vue 3 App</title>\n  </head>\n  <body>\n    <div id=\"app\"></div>\n    <script type=\"module\" src=\"/src/main.ts\"></script>\n  </body>\n</html>",
      "condition": {
        "language": ["typescript"]
      }
    }
  ],
  "viteConfig": {
    "plugins": ["vue()"],
    "resolve": {
      "alias": {
        "@": "path.resolve(__dirname, 'src')"
      }
    }
  },
  "tsConfig": {
    "extends": "@vue/tsconfig/tsconfig.dom.json",
    "include": ["env.d.ts", "src/**/*", "src/**/*.vue"],
    "compilerOptions": {
      "composite": true,
      "baseUrl": ".",
      "paths": {
        "@/*": ["./src/*"]
      }
    }
  },
  "defaultConfig": {
    "template": "vue3",
    "features": ["composition-api", "script-setup", "sfc"]
  }
}