{
  "metadata": {
    "name": "react",
    "version": "1.0.0",
    "category": "framework",
    "description": "React framework core configuration",
    "author": "Scaffold MCP Server",
    "homepage": "https://reactjs.org/",
    "keywords": ["react", "framework", "frontend", "spa", "jsx"]
  },
  "activation": {
    "framework": ["react"],
    "techStack": {
      "framework": ["react"]
    }
  },
  "dependencies": [
    {
      "name": "react",
      "version": "^18.2.0",
      "type": "dependencies"
    },
    {
      "name": "react-dom",
      "version": "^18.2.0",
      "type": "dependencies"
    },
    {
      "name": "@vitejs/plugin-react",
      "version": "^4.1.1",
      "type": "devDependencies",
      "condition": {
        "builder": ["vite"]
      }
    },
    {
      "name": "@types/react",
      "version": "^18.2.37",
      "type": "devDependencies",
      "condition": {
        "language": ["typescript"]
      }
    },
    {
      "name": "@types/react-dom",
      "version": "^18.2.15",
      "type": "devDependencies",
      "condition": {
        "language": ["typescript"]
      }
    }
  ],
  "scripts": {
    "dev": "vite",
    "build": "vite build",
    "preview": "vite preview"
  },
  "files": [
    {
      "path": "src/main.jsx",
      "content": "import React from 'react'\nimport ReactDOM from 'react-dom/client'\nimport App from './App.jsx'\nimport './index.css'\n\nReactDOM.createRoot(document.getElementById('root')).render(\n  <React.StrictMode>\n    <App />\n  </React.StrictMode>,\n)",
      "condition": {
        "language": ["javascript"]
      }
    },
    {
      "path": "src/main.tsx",
      "content": "import React from 'react'\nimport ReactDOM from 'react-dom/client'\nimport App from './App.tsx'\nimport './index.css'\n\nReactDOM.createRoot(document.getElementById('root')!).render(\n  <React.StrictMode>\n    <App />\n  </React.StrictMode>,\n)",
      "condition": {
        "language": ["typescript"]
      }
    },
    {
      "path": "src/App.jsx",
      "content": "import { useState } from 'react'\nimport reactLogo from './assets/react.svg'\nimport viteLogo from '/vite.svg'\nimport './App.css'\n\nfunction App() {\n  const [count, setCount] = useState(0)\n\n  return (\n    <>\n      <div>\n        <a href=\"https://vitejs.dev\" target=\"_blank\">\n          <img src={viteLogo} className=\"logo\" alt=\"Vite logo\" />\n        </a>\n        <a href=\"https://react.dev\" target=\"_blank\">\n          <img src={reactLogo} className=\"logo react\" alt=\"React logo\" />\n        </a>\n      </div>\n      <h1>Vite + React</h1>\n      <div className=\"card\">\n        <button onClick={() => setCount((count) => count + 1)}>\n          count is {count}\n        </button>\n        <p>\n          Edit <code>src/App.jsx</code> and save to test HMR\n        </p>\n      </div>\n      <p className=\"read-the-docs\">\n        Click on the Vite and React logos to learn more\n      </p>\n    </>\n  )\n}\n\nexport default App",
      "condition": {
        "language": ["javascript"]
      }
    },
    {
      "path": "src/App.tsx",
      "content": "import { useState } from 'react'\nimport reactLogo from './assets/react.svg'\nimport viteLogo from '/vite.svg'\nimport './App.css'\n\nfunction App() {\n  const [count, setCount] = useState(0)\n\n  return (\n    <>\n      <div>\n        <a href=\"https://vitejs.dev\" target=\"_blank\">\n          <img src={viteLogo} className=\"logo\" alt=\"Vite logo\" />\n        </a>\n        <a href=\"https://react.dev\" target=\"_blank\">\n          <img src={reactLogo} className=\"logo react\" alt=\"React logo\" />\n        </a>\n      </div>\n      <h1>Vite + React</h1>\n      <div className=\"card\">\n        <button onClick={() => setCount((count) => count + 1)}>\n          count is {count}\n        </button>\n        <p>\n          Edit <code>src/App.tsx</code> and save to test HMR\n        </p>\n      </div>\n      <p className=\"read-the-docs\">\n        Click on the Vite and React logos to learn more\n      </p>\n    </>\n  )\n}\n\nexport default App",
      "condition": {
        "language": ["typescript"]
      }
    },
    {
      "path": "src/App.css",
      "content": "#root {\n  max-width: 1280px;\n  margin: 0 auto;\n  padding: 2rem;\n  text-align: center;\n}\n\n.logo {\n  height: 6em;\n  padding: 1.5em;\n  will-change: filter;\n  transition: filter 300ms;\n}\n.logo:hover {\n  filter: drop-shadow(0 0 2em #646cffaa);\n}\n.logo.react:hover {\n  filter: drop-shadow(0 0 2em #61dafbaa);\n}\n\n@keyframes logo-spin {\n  from {\n    transform: rotate(0deg);\n  }\n  to {\n    transform: rotate(360deg);\n  }\n}\n\n@media (prefers-reduced-motion: no-preference) {\n  a:nth-of-type(2) .logo {\n    animation: logo-spin infinite 20s linear;\n  }\n}\n\n.card {\n  padding: 2em;\n}\n\n.read-the-docs {\n  color: #888;\n}"
    },
    {
      "path": "src/index.css",
      "content": ":root {\n  font-family: Inter, system-ui, Avenir, Helvetica, Arial, sans-serif;\n  line-height: 1.5;\n  font-weight: 400;\n\n  color-scheme: light dark;\n  color: rgba(255, 255, 255, 0.87);\n  background-color: #242424;\n\n  font-synthesis: none;\n  text-rendering: optimizeLegibility;\n  -webkit-font-smoothing: antialiased;\n  -moz-osx-font-smoothing: grayscale;\n  -webkit-text-size-adjust: 100%;\n}\n\na {\n  font-weight: 500;\n  color: #646cff;\n  text-decoration: inherit;\n}\na:hover {\n  color: #535bf2;\n}\n\nbody {\n  margin: 0;\n  display: flex;\n  place-items: center;\n  min-width: 320px;\n  min-height: 100vh;\n}\n\nh1 {\n  font-size: 3.2em;\n  line-height: 1.1;\n}\n\nbutton {\n  border-radius: 8px;\n  border: 1px solid transparent;\n  padding: 0.6em 1.2em;\n  font-size: 1em;\n  font-weight: 500;\n  font-family: inherit;\n  background-color: #1a1a1a;\n  color: inherit;\n  cursor: pointer;\n  transition: border-color 0.25s;\n}\nbutton:hover {\n  border-color: #646cff;\n}\nbutton:focus,\nbutton:focus-visible {\n  outline: 4px auto -webkit-focus-ring-color;\n}\n\n@media (prefers-color-scheme: light) {\n  :root {\n    color: #213547;\n    background-color: #ffffff;\n  }\n  a:hover {\n    color: #747bff;\n  }\n  button {\n    background-color: #f9f9f9;\n  }\n}"
    },
    {
      "path": "index.html",
      "content": "<!doctype html>\n<html lang=\"en\">\n  <head>\n    <meta charset=\"UTF-8\" />\n    <link rel=\"icon\" type=\"image/svg+xml\" href=\"/vite.svg\" />\n    <meta name=\"viewport\" content=\"width=device-width, initial-scale=1.0\" />\n    <title>Vite + React</title>\n  </head>\n  <body>\n    <div id=\"root\"></div>\n    <script type=\"module\" src=\"/src/main.jsx\"></script>\n  </body>\n</html>",
      "condition": {
        "language": ["javascript"]
      }
    },
    {
      "path": "index.html",
      "content": "<!doctype html>\n<html lang=\"en\">\n  <head>\n    <meta charset=\"UTF-8\" />\n    <link rel=\"icon\" type=\"image/svg+xml\" href=\"/vite.svg\" />\n    <meta name=\"viewport\" content=\"width=device-width, initial-scale=1.0\" />\n    <title>Vite + React</title>\n  </head>\n  <body>\n    <div id=\"root\"></div>\n    <script type=\"module\" src=\"/src/main.tsx\"></script>\n  </body>\n</html>",
      "condition": {
        "language": ["typescript"]
      }
    },
    {
      "path": "src/vite-env.d.ts",
      "content": "/// <reference types=\"vite/client\" />",
      "condition": {
        "language": ["typescript"]
      }
    }
  ],
  "viteConfig": {
    "plugins": ["react()"],
    "resolve": {
      "alias": {
        "@": "path.resolve(__dirname, 'src')"
      }
    }
  },
  "tsConfig": {
    "compilerOptions": {
      "target": "ES2020",
      "useDefineForClassFields": true,
      "lib": ["ES2020", "DOM", "DOM.Iterable"],
      "module": "ESNext",
      "skipLibCheck": true,
      "moduleResolution": "bundler",
      "allowImportingTsExtensions": true,
      "resolveJsonModule": true,
      "isolatedModules": true,
      "noEmit": true,
      "jsx": "react-jsx",
      "strict": true,
      "noUnusedLocals": true,
      "noUnusedParameters": true,
      "noFallthroughCasesInSwitch": true,
      "baseUrl": ".",
      "paths": {
        "@/*": ["./src/*"]
      }
    },
    "include": ["src"],
    "references": [{ "path": "./tsconfig.node.json" }]
  },
  "defaultConfig": {
    "template": "react",
    "features": ["hooks", "jsx", "strict-mode"]
  }
}