{
  "metadata": {
    "name": "commitlint",
    "version": "1.0.0",
    "category": "linting",
    "description": "Commitlint configuration for conventional commit messages",
    "author": "Scaffold MCP Server",
    "homepage": "https://commitlint.js.org/",
    "keywords": ["commitlint", "conventional-commits", "git-hooks", "commit-message", "code-quality"]
  },
  "activation": {
    "techStack": {
      "framework": ["vue", "vue3", "react", "angular"]
    }
  },
  "dependencies": [
    {
      "name": "@commitlint/cli",
      "version": "^18.4.3",
      "type": "devDependencies"
    },
    {
      "name": "@commitlint/config-conventional",
      "version": "^18.4.3",
      "type": "devDependencies"
    }
  ],
  "scripts": {
    "commitlint": "commitlint --from HEAD~1 --to HEAD --verbose"
  },
  "files": [
    {
      "path": "commitlint.config.js",
      "content": "module.exports = {\n  extends: ['@commitlint/config-conventional'],\n  rules: {\n    // 类型枚举\n    'type-enum': [\n      2,\n      'always',\n      [\n        'feat',     // 新功能\n        'fix',      // 修复bug\n        'docs',     // 文档更新\n        'style',    // 代码格式（不影响代码运行的变动）\n        'refactor', // 重构（既不是新增功能，也不是修改bug的代码变动）\n        'perf',     // 性能优化\n        'test',     // 增加测试\n        'chore',    // 构建过程或辅助工具的变动\n        'revert',   // 回滚\n        'build',    // 构建系统或外部依赖项的更改\n        'ci'        // CI配置文件和脚本的更改\n      ]\n    ],\n    // 主题不能为空\n    'subject-empty': [2, 'never'],\n    // 主题不能以句号结尾\n    'subject-full-stop': [2, 'never', '.'],\n    // 主题格式\n    'subject-case': [2, 'never', ['sentence-case', 'start-case', 'pascal-case', 'upper-case']],\n    // 类型不能为空\n    'type-empty': [2, 'never'],\n    // 类型格式\n    'type-case': [2, 'always', 'lower-case'],\n    // header最大长度\n    'header-max-length': [2, 'always', 100],\n    // body每行最大长度\n    'body-max-line-length': [2, 'always', 100],\n    // footer每行最大长度\n    'footer-max-line-length': [2, 'always', 100]\n  }\n};"
    },
    {
      "path": ".commitlintrc.js",
      "content": "module.exports = {\n  extends: ['@commitlint/config-conventional'],\n  rules: {\n    'type-enum': [\n      2,\n      'always',\n      [\n        'feat',\n        'fix',\n        'docs',\n        'style',\n        'refactor',\n        'perf',\n        'test',\n        'chore',\n        'revert',\n        'build',\n        'ci'\n      ]\n    ],\n    'subject-empty': [2, 'never'],\n    'subject-full-stop': [2, 'never', '.'],\n    'subject-case': [2, 'never', ['sentence-case', 'start-case', 'pascal-case', 'upper-case']],\n    'type-empty': [2, 'never'],\n    'type-case': [2, 'always', 'lower-case'],\n    'header-max-length': [2, 'always', 100]\n  }\n};"
    }
  ],
  "defaultConfig": {
    "extends": ["@commitlint/config-conventional"],
    "rules": {
      "type-enum": [
        2,
        "always",
        [
          "feat",
          "fix",
          "docs",
          "style",
          "refactor",
          "perf",
          "test",
          "chore",
          "revert",
          "build",
          "ci"
        ]
      ]
    }
  }
}