{
  "metadata": {
    "name": "stylelint",
    "version": "1.0.0",
    "category": "linting",
    "description": "Stylelint CSS/SCSS/Less linting configuration",
    "author": "Scaffold MCP Server",
    "homepage": "https://stylelint.io/",
    "keywords": ["stylelint", "css", "scss", "less", "linting", "code-quality"]
  },
  "activation": {
    "techStack": {
      "framework": ["vue", "vue3", "react", "angular"]
    }
  },
  "dependencies": [
    {
      "name": "stylelint",
      "version": "^15.11.0",
      "type": "devDependencies"
    },
    {
      "name": "stylelint-config-standard",
      "version": "^34.0.0",
      "type": "devDependencies"
    },
    {
      "name": "stylelint-config-recommended-vue",
      "version": "^1.5.0",
      "type": "devDependencies",
      "condition": {
        "framework": ["vue", "vue3"]
      }
    },
    {
      "name": "stylelint-config-standard-scss",
      "version": "^11.1.0",
      "type": "devDependencies"
    },
    {
      "name": "stylelint-scss",
      "version": "^5.3.1",
      "type": "devDependencies"
    },
    {
      "name": "stylelint-order",
      "version": "^6.0.3",
      "type": "devDependencies"
    }
  ],
  "scripts": {
    "lint:style": "stylelint \"src/**/*.{css,scss,vue}\" --fix",
    "lint:style-check": "stylelint \"src/**/*.{css,scss,vue}\""
  },
  "files": [
    {
      "path": ".stylelintrc.js",
      "content": "module.exports = {\n  extends: [\n    'stylelint-config-standard',\n    'stylelint-config-standard-scss'\n  ],\n  plugins: [\n    'stylelint-scss',\n    'stylelint-order'\n  ],\n  rules: {\n    // 禁用一些过于严格的规则\n    'selector-class-pattern': null,\n    'custom-property-pattern': null,\n    'scss/dollar-variable-pattern': null,\n    'scss/percent-placeholder-pattern': null,\n    \n    // 属性排序\n    'order/properties-order': [\n      'position',\n      'top',\n      'right',\n      'bottom',\n      'left',\n      'z-index',\n      'display',\n      'flex-direction',\n      'flex-wrap',\n      'justify-content',\n      'align-items',\n      'align-content',\n      'flex',\n      'flex-grow',\n      'flex-shrink',\n      'flex-basis',\n      'order',\n      'width',\n      'min-width',\n      'max-width',\n      'height',\n      'min-height',\n      'max-height',\n      'margin',\n      'margin-top',\n      'margin-right',\n      'margin-bottom',\n      'margin-left',\n      'padding',\n      'padding-top',\n      'padding-right',\n      'padding-bottom',\n      'padding-left',\n      'border',\n      'border-radius',\n      'background',\n      'background-color',\n      'color',\n      'font-family',\n      'font-size',\n      'font-weight',\n      'line-height',\n      'text-align',\n      'text-decoration',\n      'opacity',\n      'visibility',\n      'overflow',\n      'transform',\n      'transition'\n    ],\n    \n    // 其他规则\n    'declaration-empty-line-before': null,\n    'rule-empty-line-before': [\n      'always-multi-line',\n      {\n        except: ['first-nested'],\n        ignore: ['after-comment']\n      }\n    ],\n    'at-rule-empty-line-before': [\n      'always',\n      {\n        except: ['blockless-after-same-name-blockless', 'first-nested'],\n        ignore: ['after-comment']\n      }\n    ]\n  },\n  ignoreFiles: [\n    'node_modules/**/*',\n    'dist/**/*',\n    'build/**/*',\n    '**/*.min.css'\n  ]\n};"
    },
    {
      "path": ".stylelintrc.vue.js",
      "content": "module.exports = {\n  extends: [\n    'stylelint-config-standard',\n    'stylelint-config-recommended-vue',\n    'stylelint-config-standard-scss'\n  ],\n  plugins: [\n    'stylelint-scss',\n    'stylelint-order'\n  ],\n  rules: {\n    // Vue 特定规则\n    'selector-pseudo-element-no-unknown': [\n      true,\n      {\n        ignorePseudoElements: ['v-deep', 'v-global', 'v-slotted']\n      }\n    ],\n    'selector-pseudo-class-no-unknown': [\n      true,\n      {\n        ignorePseudoClasses: ['deep', 'global', 'slotted']\n      }\n    ],\n    \n    // 禁用一些过于严格的规则\n    'selector-class-pattern': null,\n    'custom-property-pattern': null,\n    'scss/dollar-variable-pattern': null,\n    'scss/percent-placeholder-pattern': null,\n    \n    // 属性排序\n    'order/properties-order': [\n      'position',\n      'top',\n      'right',\n      'bottom',\n      'left',\n      'z-index',\n      'display',\n      'flex-direction',\n      'flex-wrap',\n      'justify-content',\n      'align-items',\n      'align-content',\n      'flex',\n      'flex-grow',\n      'flex-shrink',\n      'flex-basis',\n      'order',\n      'width',\n      'min-width',\n      'max-width',\n      'height',\n      'min-height',\n      'max-height',\n      'margin',\n      'margin-top',\n      'margin-right',\n      'margin-bottom',\n      'margin-left',\n      'padding',\n      'padding-top',\n      'padding-right',\n      'padding-bottom',\n      'padding-left',\n      'border',\n      'border-radius',\n      'background',\n      'background-color',\n      'color',\n      'font-family',\n      'font-size',\n      'font-weight',\n      'line-height',\n      'text-align',\n      'text-decoration',\n      'opacity',\n      'visibility',\n      'overflow',\n      'transform',\n      'transition'\n    ]\n  },\n  overrides: [\n    {\n      files: ['*.vue', '**/*.vue'],\n      customSyntax: 'postcss-html'\n    },\n    {\n      files: ['*.scss', '**/*.scss'],\n      customSyntax: 'postcss-scss'\n    }\n  ],\n  ignoreFiles: [\n    'node_modules/**/*',\n    'dist/**/*',\n    'build/**/*',\n    '**/*.min.css'\n  ]\n};",
      "condition": {
        "framework": ["vue", "vue3"]
      }
    }
  ],
  "defaultConfig": {
    "extends": ["stylelint-config-standard"],
    "rules": {
      "selector-class-pattern": null,
      "custom-property-pattern": null
    }
  }
}